{
  "contract_version": "devgate.oap-evidence/v1",
  "direction": "devgate-to-oap",
  "producer": {
    "product": "DevGate",
    "version": "fixture",
    "instance_id": "fixture-runner",
    "key_id": "fixture-key"
  },
  "consumer_audience": "oap-observer",
  "operation_scope": {
    "operation": "release-evidence-observation",
    "purpose": "evidence-observation",
    "effect_authority": "none"
  },
  "tenant_or_project_id": "fixture-project",
  "subject": {
    "kind": "repository",
    "id": "fixture-subject"
  },
  "request_id": "request-001",
  "evaluation_id": "evaluation-001",
  "idempotency_key": "idempotency-001",
  "devgate": {
    "result_digest": "sha256:aaaaaaaaaaaaaaaaaaaaaaaaaaaaaaaaaaaaaaaaaaaaaaaaaaaaaaaaaaaaaaaa",
    "evidence_manifest_digest": "sha256:bbbbbbbbbbbbbbbbbbbbbbbbbbbbbbbbbbbbbbbbbbbbbbbbbbbbbbbbbbbbbbbb",
    "attestation_ref": "artifact://attestation.json",
    "decision": "PASS",
    "exit_code": 0,
    "semantics": "fresh-promotion",
    "identities": {
      "subject_digest": "sha256:cccccccccccccccccccccccccccccccccccccccccccccccccccccccccccccccc",
      "openspec_digest": "sha256:dddddddddddddddddddddddddddddddddddddddddddddddddddddddddddddddd",
      "policy_digest": "sha256:eeeeeeeeeeeeeeeeeeeeeeeeeeeeeeeeeeeeeeeeeeeeeeeeeeeeeeeeeeeeeeee",
      "context_digest": "sha256:ffffffffffffffffffffffffffffffffffffffffffffffffffffffffffffffff",
      "evaluator_image_digest": "sha256:1111111111111111111111111111111111111111111111111111111111111111"
    }
  },
  "native_status": "PASS",
  "native_reason": "all required assertions satisfied",
  "redaction_class": "secret-free",
  "retention_class": "standard",
  "evidence_refs": [
    {
      "name": "result.json",
      "digest": "sha256:aaaaaaaaaaaaaaaaaaaaaaaaaaaaaaaaaaaaaaaaaaaaaaaaaaaaaaaaaaaaaaaa",
      "purpose": "canonical-result"
    },
    {
      "name": "evidence-manifest.json",
      "digest": "sha256:bbbbbbbbbbbbbbbbbbbbbbbbbbbbbbbbbbbbbbbbbbbbbbbbbbbbbbbbbbbbbbbb",
      "purpose": "evidence-manifest"
    },
    {
      "name": "attestation.json",
      "digest": "sha256:9999999999999999999999999999999999999999999999999999999999999999",
      "purpose": "attestation"
    }
  ],
  "created_at": "2026-10-04T12:00:00Z",
  "expires_at": "2026-10-04T13:00:00Z",
  "observe_only": true
}
